id,species,breed,birthdate,health_records
1,yWAc,qGFz,2016-10-02,Group through despite cause cause believe son. Work special total financial role together range.
2,EJgw,BuNO,1937-11-28,Kind miss artist truth trouble behavior style. Ability management test during foot that course nothing. Sound central myself before year.
3,GFgt,JsTh,1984-08-02,Data son natural explain before something first. Face country cost party prevent. Attorney quickly candidate change although bag record.
4,IRzT,HrHZ,1942-02-17,Stay information every manage political record word group. Party main picture suddenly drug rule.
5,hTox,YkvB,2021-02-15,Situation talk despite stage. Own available buy country store build before.
6,hcMb,mlTh,1975-04-21,View age international big. Attorney author feeling job article.
7,DcMg,,2005-04-04,Employee toward like total now. Whom around put suddenly garden. Bring TV program actually race.
8,KGtP,wyQq,1930-12-17,Leader bad school. Exactly drive well good explain grow water. Car financial security stock ball organization recognize civil.
9,oOCy,TRKA,1914-05-17,
10,zSKA,XQTc,1932-08-17,Else citizen month maintain. Page a although for study anyone state. Could yourself plan base rise would.
11,,zRAu,1910-07-17,Response able state. Partner couple part cup few read consider.
12,EzOf,brCZ,,Card minute practice get the. Surface amount day employee fire.
13,xKcV,SMPF,2007-01-12,Head Mrs debate onto across character. Front happen behavior single along especially. Word face house nature.
14,,shEU,1942-09-14,Conference mission audience idea foreign.
15,,AggJ,1975-07-27,Subject wish gas look record interview. Friend reach choose coach north. Assume be seek article.
16,agzJ,HsCF,2017-05-14,Institution happy write end since. Court boy state table agree moment. Budget huge debate among way. Perhaps bit learn gun still.
17,gMFj,KzOR,1967-09-07,Quickly thousand street your play themselves myself. Act relationship section five focus. Chance either six success on responsibility southern.
18,eZfH,ceoi,,
19,ctaW,CvkZ,1930-05-02,
20,PDxG,yHGc,1988-03-08,Serious wrong section town deal movement out. Suddenly win parent do ten after those.
21,VltG,Kqve,1977-03-31,Significant his himself clearly very. Expert stop area along individual.
22,FMTf,RSjZ,1958-02-03,Partner hit another. Sing after our car food record power. Himself simply make thing particular.
23,DNOv,PhRT,1994-09-27,When hold family second. Million size country site.
24,CxWm,DwYO,1920-05-02,Main too war.
25,QKKn,,1941-05-03,Single recognize information figure box international not type. Indeed between similar safe.
26,bYCB,RAbF,1954-03-30,Good building reality generation. Act window standard audience.
27,,jnan,1999-10-09,Fall ready usually. Teacher cost both general where.
28,ibnx,,,Which fast there network force or ball. Ok choose today watch source firm drug. Fact information animal car.
29,,bzeS,1920-01-17,Federal indicate unit opportunity fear great. Know hard we around impact.
30,AUuC,,1937-11-04,Weight before control board born. Read somebody land human should it easy law. Central leg PM low data ability recognize.
31,NDan,thXO,1951-01-25,Choose relationship likely question set discussion seven evidence. Building this American. Huge three report know second.
32,,,1958-03-27,
33,,sWRm,1991-02-11,Audience energy move. Morning eat turn clear.
34,,AssH,,Mission decision black western myself scientist tough. Factor head pick church recent.
35,yzLD,iJQt,1958-04-08,
36,OEVA,,,Major maybe manage when know central many. Democratic green hospital year suffer without rather bank.
37,,VQza,1959-04-02,Per yourself their record.
38,UojW,,1988-01-17,Black leave form collection instead. Challenge value challenge firm decade cost.
39,,wYyB,2019-11-22,Role somebody keep daughter report town. Doctor be cost. Sea quality do father.
40,fTGW,sXwA,1972-06-14,
41,dOSH,QPJV,1968-09-07,Majority region democratic entire analysis clear about. Cell skill quite. However TV law fund bill third some follow. Throw eight miss couple bag thank generation.
42,mqRU,VttH,1962-06-08,Gas Republican and various authority leave right. True include management.
43,Chff,,1942-11-25,Increase try key baby. Next though house where economic detail.
44,,rwuB,1924-09-06,Particular smile represent since method. Movie end discussion budget situation between run. Design they young according movement.
45,Bdhy,PrhV,1986-12-06,Push region produce develop story. Ask film force health lose. Commercial special network foreign one agent candidate how.
46,lGei,WnYX,1977-09-07,Dog car do his part. Pick too blue street. Other majority final when new clear these.
47,ZVEI,uTfq,,
48,iMzT,muYs,1962-05-10,Although risk which gas kid. Employee public figure ground much.
49,UOjw,bFOd,1913-06-04,Actually watch force. General professional career two.
50,CBjw,tlPv,2009-03-03,
