id,farm_id,make,model,purchase_date,maintenance_schedule,condition
1,50,vqvo,dVHp,2026-01-22,Question him amount. Resource box during star much. Change resource occur music item land.,lcxR
2,23,sVvO,,2026-01-14,Accept teach short water career wind. Thus close among move class often.,fijJ
3,2,lAyb,xswX,2026-01-28,,WbpL
4,42,,axXX,2026-01-18,Worry put he ask. Guess what edge change structure. Outside voice measure under.,uLLJ
5,46,ONgN,kwqD,2026-01-13,House growth fish else. From side hear health. Standard increase deal citizen least organization.,QYLT
6,19,pWax,,,Kid why nothing. Subject you face ready.,BaTN
7,22,ozNF,FMBz,2026-01-20,Compare television fly mean last. Test direction call adult toward small finish.,wGWo
8,11,tKbF,Sirn,2026-01-19,Perhaps where dinner according system.,
9,2,Myiq,,2026-01-29,,ZJmX
10,21,,,2026-01-07,Station than western lose throughout statement like. Air out price interest. Something face material however you.,pYDZ
11,14,mSlF,,2026-01-23,Dark factor tell billion establish character.,ntik
12,48,wnKL,,2026-01-08,Call various offer exist. Everything war he including.,vTMJ
13,44,HOqg,JJZd,2026-01-02,,vUBM
14,11,,,2026-01-24,Soon budget instead property or their that nation. American call statement specific. Special might wish street space human.,ThgN
15,10,,Jmnu,2026-01-27,,zjcf
16,11,cOwn,AKSP,2026-01-06,Full billion rise situation event. Democratic summer itself tax. Whether exactly resource.,nGgZ
17,39,,WNxO,2026-01-17,Do often not not produce enter political. Beyond former perform.,
18,22,gpYt,YKeg,,Chance foot candidate case research approach live. Dog than design staff forward respond bill. Dark power energy look source protect owner.,
19,6,KzwB,qyki,2026-01-29,Body doctor tough radio not account land. How eye fire growth alone. Occur person social.,
20,49,VddA,NtCv,2026-01-02,Blood event say son and give. Per second add picture. Better of music defense ok still beyond Congress.,jJpo
21,19,EMqz,ndHH,2026-01-24,Candidate reality process at direction. Choice their make eight.,ZmJc
22,44,,JSQy,,Score speak answer fill on program others. Forward policy mouth success federal movement.,
23,18,pvUt,,2026-01-12,Evening small focus floor subject debate. Field crime drug wall. Firm industry let summer.,rHxz
24,19,eLEC,RgkO,2026-01-06,Enter hope current page skill. International time sound here environment list. Opportunity trade along which worry door tonight.,UvBi
25,17,GsWF,pOer,2026-01-08,East actually response kid feeling. After level pattern side collection cold team. Human before tell ago question left meeting. Would arrive teacher where close.,nOhI
26,38,HgHn,OXTV,2026-01-28,,zuro
27,10,VMdu,RrfT,,Structure control learn age great itself community require. System involve require region. Feel wear official area agency. Speech lawyer west particularly everything former.,xieP
28,23,CIhU,gjkv,2026-01-21,Economy goal government medical science mind through. Walk inside yes book.,TADY
29,11,,,,,eVgU
30,47,DOjy,VlAJ,2026-01-02,Everything center wind note national finish. Country program prove very street know rich medical. Network alone culture exist.,nqdG
31,13,,xSUs,2026-01-19,Cover feel debate. About into nearly water realize.,RgxA
32,5,oWrX,,,Government choice before Democrat among hotel service. Forget crime resource door only. Sit six day.,klCo
33,39,cfoz,zBOW,2026-01-02,,jNsT
34,46,ZtPc,KntF,2026-01-19,Purpose ready become leader difference ok some group. Tax financial scientist sign attention provide itself.,mFnF
35,46,JRUz,HEkj,2026-01-01,Available include there floor run bag should. Future people require quality information citizen without Mrs. Upon operation prevent manage line return.,
36,43,RJxE,NePt,2026-01-11,Goal position sing loss guess either not. Career professor experience ball role their once should. Wear southern lot consider stay throughout itself.,
37,27,tBdS,ccpB,2026-01-05,Like decide environment adult listen another.,bqjC
38,11,Wknp,PoIQ,2026-01-01,Major charge author themselves other today PM. Should enough act end value new.,fxUu
39,16,OHPm,IRNZ,,Night whether model citizen government. Expect theory meet morning. Head huge standard turn. Impact next not.,QVKU
40,37,upWb,dcbo,2026-01-16,Same wall wife before eight arm seven interest. Even side over role score.,iIhx
41,46,,,2026-01-18,,Yrxd
42,26,eAsZ,xrai,2026-01-24,Daughter interest move authority compare. Do network expert relationship seven her personal Democrat. North while measure trial whose thus goal test.,uvTS
43,6,MNYb,BWPU,2026-01-06,Instead dream surface health heart hold. Those report reason country debate son stuff. Cover front system help.,egYM
44,28,JNcx,jkwD,2026-01-21,Various eye focus school yard. Production cause music picture. Business us region receive for data.,
45,30,TsxN,dgSC,2026-01-27,Admit live down daughter trip. Cup he father evidence question fund arrive clearly. Run its near really. Little Mr population add age letter religious.,pHdR
46,26,gygA,iEKK,,Hit thank most of up organization left. Laugh action short us.,EFyr
47,1,,PWDv,2026-01-27,Offer present pretty language. Environment different some another run wall force.,FpML
48,2,bIOm,KXvm,2026-01-08,Mr consider that performance black red himself. Pattern hard however sign.,RAZI
49,43,,,2026-01-24,Instead smile happen successful human. Public according understand happen begin actually.,
50,9,AnLB,pPOU,2026-01-21,Admit play avoid few. Day dog receive wife. Fall spring choose power management sell.,FPNe
